{
  "format": "mp3",
  "tool": {
    "name": "irreversible_scrubber",
    "version": "0.1.0-p2",
    "invocation": "python -m src.scrub {in} {out} --fidelity {fidelity}"
  },
  "generated_at": "2026-08-02T18:06:22.217564+00:00",
  "harness_version": "0.1.0",
  "cells": [
    {
      "adversary": "A1",
      "fidelity": "F1",
      "verdict": "pass",
      "noise_floor": {
        "deterministic": true,
        "repeats": 5,
        "variable_loci": []
      }
    },
    {
      "adversary": "A1",
      "fidelity": "F2",
      "verdict": "not_applicable",
      "reason": "lossless_reencode_not_applicable_to_mp3"
    },
    {
      "adversary": "A1",
      "fidelity": "F3",
      "verdict": "pass",
      "noise_floor": {
        "deterministic": true,
        "repeats": 5,
        "variable_loci": []
      }
    },
    {
      "adversary": "A2",
      "fidelity": "F2",
      "verdict": "not_applicable",
      "reason": "lossless_reencode_not_applicable_to_mp3"
    },
    {
      "adversary": "A2",
      "fidelity": "F1",
      "verdict": "fail",
      "reason": "encoder_fingerprint_survives (LAME/Xing + bitrate contour): struct:bitrate_hist, struct:channel_mode, struct:lame_version, struct:size, struct:xing_magic",
      "leaks": [
        {
          "kind": "source_fingerprint",
          "locus": {
            "space": "structural",
            "offset": null,
            "length": null,
            "feature_id": "struct:lame_version",
            "annotated_as": null,
            "hex_context": null
          },
          "correlates_with": "producer (across 3)",
          "evidence": "struct:lame_version constant within producer, differs across"
        },
        {
          "kind": "source_fingerprint",
          "locus": {
            "space": "structural",
            "offset": null,
            "length": null,
            "feature_id": "struct:channel_mode",
            "annotated_as": null,
            "hex_context": null
          },
          "correlates_with": "producer (across 2)",
          "evidence": "struct:channel_mode constant within producer, differs across"
        },
        {
          "kind": "source_fingerprint",
          "locus": {
            "space": "structural",
            "offset": null,
            "length": null,
            "feature_id": "struct:size",
            "annotated_as": null,
            "hex_context": null
          },
          "correlates_with": "producer (across 3)",
          "evidence": "struct:size constant within producer, differs across"
        },
        {
          "kind": "source_fingerprint",
          "locus": {
            "space": "structural",
            "offset": null,
            "length": null,
            "feature_id": "struct:bitrate_hist",
            "annotated_as": null,
            "hex_context": null
          },
          "correlates_with": "producer (across 3)",
          "evidence": "struct:bitrate_hist constant within producer, differs across"
        },
        {
          "kind": "source_fingerprint",
          "locus": {
            "space": "structural",
            "offset": null,
            "length": null,
            "feature_id": "struct:xing_magic",
            "annotated_as": null,
            "hex_context": null
          },
          "correlates_with": "producer (across 2)",
          "evidence": "struct:xing_magic constant within producer, differs across"
        }
      ]
    },
    {
      "adversary": "A2",
      "fidelity": "F3",
      "verdict": "pass",
      "reason": "encoder fingerprint normalized to the canonical LAME class; peer set = lame_vbr, ffmpeg_vbr, shine_cbr (cross-engine), sample rates [44100, 22050]. Verified per rate group \u2014 44100 Hz: pass; 22050 Hz: pass. Cross-engine audio residual measured and NOT found, per sample-rate group \u2014 engine classification accuracy unscrubbed -> after F3, 44100 Hz: 0.94 -> 0.50 (chance 0.50); 22050 Hz: 1.00 -> 0.61 (chance 0.50) (E-ENGINE, leave-one-content-out over broadband audio). Scope: spectral features; MDCT-domain classifiers untested. Residual: anonymity is WITHIN a sample-rate group, not one universal class \u2014 192 kbps CBR is illegal for MPEG-2 rates, so those files emit at 160 and form their own group. The group follows the source's sample rate, which is content we preserve by design, not a producer trait. Plus one generation of loss."
    },
    {
      "adversary": "A3",
      "fidelity": "F1",
      "verdict": "not_tested",
      "reason": "out_of_scope_threat_model"
    },
    {
      "adversary": "A3",
      "fidelity": "F2",
      "verdict": "not_tested",
      "reason": "out_of_scope_threat_model"
    },
    {
      "adversary": "A3",
      "fidelity": "F3",
      "verdict": "not_tested",
      "reason": "out_of_scope_threat_model"
    }
  ],
  "scrubber_fingerprint": {
    "checked": true,
    "verdict": "pass",
    "mandatory_constants_excluded": [
      {
        "bytes_hex": "ff",
        "decoded": "\u00ff"
      }
    ],
    "signatures": []
  }
}