{
  "format": "mp4",
  "tool": {
    "name": "irreversible_scrubber",
    "version": "0.1.0-p4",
    "invocation": "python -m src.scrub {in} {out} --fidelity {fidelity}"
  },
  "generated_at": "2026-10-13T11:19:20.683188+00:00",
  "harness_version": "0.1.0",
  "cells": [
    {
      "adversary": "A1",
      "fidelity": "F1",
      "verdict": "pass",
      "reason": "no metadata-correlated byte survives: udta/loci, tag lists, header timestamps, handler names; and position stored as track samples or vendor boxes -- GoPro GPMF telemetry, timecode and camera serial, a 360 camera's camm track, Android's location box, model keys and Samsung trailer"
    },
    {
      "adversary": "A1",
      "fidelity": "F2",
      "verdict": "not_tested",
      "reason": "mp4_f2_not_built: a lossless re-mux through one canonical muxer (one brand, one compatible-brand list, one top-level order, one `moov` position, track IDs renumbered from 1 with next_track_ID one past them) is the next step, and the A2@F1 leaks are its specification; removing an encoder's SEI settings string from the coded video is the other lossless candidate (M13, unmeasured)"
    },
    {
      "adversary": "A1",
      "fidelity": "F3",
      "verdict": "not_tested",
      "reason": "mp4_f3_not_built: would mean re-encoding the video, which Phase 4 has not measured"
    },
    {
      "adversary": "A2",
      "fidelity": "F1",
      "verdict": "fail",
      "reason": "producer still identifiable. Leaking by channel \u2014 muxer: struct:brand, struct:compatible_brands, struct:moov_before_mdat, struct:top_level_order; size: struct:size. Peer set = ffmpeg_plain, ffmpeg_faststart, ffmpeg_videotoolbox, avfoundation.",
      "leaks": [
        {
          "kind": "source_fingerprint",
          "locus": {
            "space": "structural",
            "offset": null,
            "length": null,
            "feature_id": "struct:brand",
            "annotated_as": null,
            "hex_context": null
          },
          "correlates_with": "producer (across 2)",
          "evidence": "struct:brand constant within producer, differs across"
        },
        {
          "kind": "source_fingerprint",
          "locus": {
            "space": "structural",
            "offset": null,
            "length": null,
            "feature_id": "struct:compatible_brands",
            "annotated_as": null,
            "hex_context": null
          },
          "correlates_with": "producer (across 2)",
          "evidence": "struct:compatible_brands constant within producer, differs across"
        },
        {
          "kind": "source_fingerprint",
          "locus": {
            "space": "structural",
            "offset": null,
            "length": null,
            "feature_id": "struct:moov_before_mdat",
            "annotated_as": null,
            "hex_context": null
          },
          "correlates_with": "producer (across 2)",
          "evidence": "struct:moov_before_mdat constant within producer, differs across"
        },
        {
          "kind": "source_fingerprint",
          "locus": {
            "space": "structural",
            "offset": null,
            "length": null,
            "feature_id": "struct:size",
            "annotated_as": null,
            "hex_context": null
          },
          "correlates_with": "producer (across 3)",
          "evidence": "struct:size constant within producer, differs across"
        },
        {
          "kind": "source_fingerprint",
          "locus": {
            "space": "structural",
            "offset": null,
            "length": null,
            "feature_id": "struct:top_level_order",
            "annotated_as": null,
            "hex_context": null
          },
          "correlates_with": "producer (across 2)",
          "evidence": "struct:top_level_order constant within producer, differs across"
        }
      ]
    },
    {
      "adversary": "A2",
      "fidelity": "F2",
      "verdict": "not_tested",
      "reason": "mp4_f2_not_built: a lossless re-mux through one canonical muxer (one brand, one compatible-brand list, one top-level order, one `moov` position, track IDs renumbered from 1 with next_track_ID one past them) is the next step, and the A2@F1 leaks are its specification; removing an encoder's SEI settings string from the coded video is the other lossless candidate (M13, unmeasured)"
    },
    {
      "adversary": "A2",
      "fidelity": "F3",
      "verdict": "not_tested",
      "reason": "mp4_f3_not_built: would mean re-encoding the video, which Phase 4 has not measured"
    },
    {
      "adversary": "A3",
      "fidelity": "F1",
      "verdict": "not_tested",
      "reason": "out_of_scope_threat_model"
    },
    {
      "adversary": "A3",
      "fidelity": "F2",
      "verdict": "not_tested",
      "reason": "out_of_scope_threat_model"
    },
    {
      "adversary": "A3",
      "fidelity": "F3",
      "verdict": "not_tested",
      "reason": "out_of_scope_threat_model"
    }
  ],
  "scrubber_fingerprint": {
    "checked": true,
    "verdict": "pass",
    "mandatory_constants_excluded": [
      {
        "bytes_hex": "66747970",
        "decoded": "ftyp"
      },
      {
        "bytes_hex": "6d6f6f76",
        "decoded": "moov"
      },
      {
        "bytes_hex": "6d646174",
        "decoded": "mdat"
      },
      {
        "bytes_hex": "6d766864",
        "decoded": "mvhd"
      },
      {
        "bytes_hex": "7472616b",
        "decoded": "trak"
      },
      {
        "bytes_hex": "6d646961",
        "decoded": "mdia"
      },
      {
        "bytes_hex": "6d696e66",
        "decoded": "minf"
      },
      {
        "bytes_hex": "7374626c",
        "decoded": "stbl"
      },
      {
        "bytes_hex": "73747364",
        "decoded": "stsd"
      },
      {
        "bytes_hex": "61766331",
        "decoded": "avc1"
      },
      {
        "bytes_hex": "6d703461",
        "decoded": "mp4a"
      },
      {
        "bytes_hex": "766d6864",
        "decoded": "vmhd"
      },
      {
        "bytes_hex": "736d6864",
        "decoded": "smhd"
      },
      {
        "bytes_hex": "000000000000002168646c720000000000000000736f756e0000000000000000000000000000000000",
        "decoded": "\u0000\u0000\u0000\u0000\u0000\u0000\u0000!hdlr\u0000\u0000\u0000\u0000\u0000\u0000\u0000\u0000soun\u0000\u0000\u0000\u0000\u0000\u0000\u0000\u0000\u0000\u0000\u0000\u0000\u0000\u0000\u0000\u0000\u0000"
      },
      {
        "bytes_hex": "000000000000002168646c720000000000000000766964650000000000000000000000000000000000",
        "decoded": "\u0000\u0000\u0000\u0000\u0000\u0000\u0000!hdlr\u0000\u0000\u0000\u0000\u0000\u0000\u0000\u0000vide\u0000\u0000\u0000\u0000\u0000\u0000\u0000\u0000\u0000\u0000\u0000\u0000\u0000\u0000\u0000\u0000\u0000"
      },
      {
        "bytes_hex": "000000000000002168646c7200000000000000006d6469720000000000000000000000000000000000",
        "decoded": "\u0000\u0000\u0000\u0000\u0000\u0000\u0000!hdlr\u0000\u0000\u0000\u0000\u0000\u0000\u0000\u0000mdir\u0000\u0000\u0000\u0000\u0000\u0000\u0000\u0000\u0000\u0000\u0000\u0000\u0000\u0000\u0000\u0000\u0000"
      },
      {
        "bytes_hex": "000000000000002168646c7200000000000000006d6474610000000000000000000000000000000000",
        "decoded": "\u0000\u0000\u0000\u0000\u0000\u0000\u0000!hdlr\u0000\u0000\u0000\u0000\u0000\u0000\u0000\u0000mdta\u0000\u0000\u0000\u0000\u0000\u0000\u0000\u0000\u0000\u0000\u0000\u0000\u0000\u0000\u0000\u0000\u0000"
      }
    ],
    "signatures": []
  }
}