{
  "format": "gif",
  "tool": {
    "name": "irreversible_scrubber",
    "version": "0.1.0-p6",
    "invocation": "python -m src.scrub {in} {out} --fidelity {fidelity}"
  },
  "generated_at": "2026-10-13T06:16:50.186437+00:00",
  "harness_version": "0.1.0",
  "cells": [
    {
      "adversary": "A1",
      "fidelity": "F1",
      "verdict": "pass",
      "reason": "no metadata-correlated byte survives, still or animated (a comment, XMP, an unknown application extension, a personal ICC header, bytes after the trailer)"
    },
    {
      "adversary": "A1",
      "fidelity": "F2",
      "verdict": "not_tested",
      "reason": "gif_f2_f3_not_built: a canonical re-encode (the frames through one LZW writer and one palette rule) is not built"
    },
    {
      "adversary": "A1",
      "fidelity": "F3",
      "verdict": "not_tested",
      "reason": "gif_f2_f3_not_built: a canonical re-encode (the frames through one LZW writer and one palette rule) is not built"
    },
    {
      "adversary": "A2",
      "fidelity": "F1",
      "verdict": "fail",
      "reason": "writer still identifiable: blocks, images, screen_flags, size. Peer set = pillow, pillow_optimize, macos_sips (decoded colours identical).",
      "leaks": [
        {
          "kind": "source_fingerprint",
          "locus": {
            "space": "structural",
            "offset": null,
            "length": null,
            "feature_id": "struct:blocks",
            "annotated_as": null,
            "hex_context": null
          },
          "correlates_with": "GIF writer",
          "evidence": "struct:blocks constant within an encoder, differs across"
        },
        {
          "kind": "source_fingerprint",
          "locus": {
            "space": "structural",
            "offset": null,
            "length": null,
            "feature_id": "struct:images",
            "annotated_as": null,
            "hex_context": null
          },
          "correlates_with": "GIF writer",
          "evidence": "struct:images constant within an encoder, differs across"
        },
        {
          "kind": "source_fingerprint",
          "locus": {
            "space": "structural",
            "offset": null,
            "length": null,
            "feature_id": "struct:screen_flags",
            "annotated_as": null,
            "hex_context": null
          },
          "correlates_with": "GIF writer",
          "evidence": "struct:screen_flags constant within an encoder, differs across"
        },
        {
          "kind": "source_fingerprint",
          "locus": {
            "space": "structural",
            "offset": null,
            "length": null,
            "feature_id": "struct:size",
            "annotated_as": null,
            "hex_context": null
          },
          "correlates_with": "GIF writer",
          "evidence": "struct:size constant within an encoder, differs across"
        }
      ]
    },
    {
      "adversary": "A2",
      "fidelity": "F2",
      "verdict": "not_tested",
      "reason": "gif_f2_f3_not_built: a canonical re-encode (the frames through one LZW writer and one palette rule) is not built"
    },
    {
      "adversary": "A2",
      "fidelity": "F3",
      "verdict": "not_tested",
      "reason": "gif_f2_f3_not_built: a canonical re-encode (the frames through one LZW writer and one palette rule) is not built"
    },
    {
      "adversary": "A3",
      "fidelity": "F1",
      "verdict": "not_tested",
      "reason": "out_of_scope_threat_model"
    },
    {
      "adversary": "A3",
      "fidelity": "F2",
      "verdict": "not_tested",
      "reason": "out_of_scope_threat_model"
    },
    {
      "adversary": "A3",
      "fidelity": "F3",
      "verdict": "not_tested",
      "reason": "out_of_scope_threat_model"
    }
  ],
  "scrubber_fingerprint": {
    "checked": true,
    "verdict": "pass",
    "mandatory_constants_excluded": [],
    "signatures": []
  }
}