{
  "format": "webp",
  "tool": {
    "name": "irreversible_scrubber",
    "version": "0.1.0-p6",
    "invocation": "python -m src.scrub {in} {out} --fidelity {fidelity}"
  },
  "generated_at": "2026-10-13T06:16:51.275148+00:00",
  "harness_version": "0.1.0",
  "cells": [
    {
      "adversary": "A1",
      "fidelity": "F1",
      "verdict": "pass",
      "reason": "no metadata-correlated byte survives, still or animated (EXIF, XMP, a personal ICC header, unknown chunks at the top level and inside frames, bytes after the RIFF's end)"
    },
    {
      "adversary": "A1",
      "fidelity": "F2",
      "verdict": "not_tested",
      "reason": "webp_f2_f3_not_built: a canonical re-encode (lossless for VP8L, lossy for VP8) is not built"
    },
    {
      "adversary": "A1",
      "fidelity": "F3",
      "verdict": "not_tested",
      "reason": "webp_f2_f3_not_built: a canonical re-encode (lossless for VP8L, lossy for VP8) is not built"
    },
    {
      "adversary": "A2",
      "fidelity": "F1",
      "verdict": "fail",
      "reason": "encoder still identifiable only through FILE SIZE: the container is identical, and the encoder shows only in how well it compressed -- the bitstream F1 copies by definition. Peer set = pillow_m0, pillow_m6, cwebp_lossless (lossless, pixels identical).",
      "leaks": [
        {
          "kind": "source_fingerprint",
          "locus": {
            "space": "structural",
            "offset": null,
            "length": null,
            "feature_id": "struct:size",
            "annotated_as": null,
            "hex_context": null
          },
          "correlates_with": "WebP encoder",
          "evidence": "struct:size constant within an encoder, differs across"
        }
      ]
    },
    {
      "adversary": "A2",
      "fidelity": "F2",
      "verdict": "not_tested",
      "reason": "webp_f2_f3_not_built: a canonical re-encode (lossless for VP8L, lossy for VP8) is not built"
    },
    {
      "adversary": "A2",
      "fidelity": "F3",
      "verdict": "not_tested",
      "reason": "webp_f2_f3_not_built: a canonical re-encode (lossless for VP8L, lossy for VP8) is not built"
    },
    {
      "adversary": "A3",
      "fidelity": "F1",
      "verdict": "not_tested",
      "reason": "out_of_scope_threat_model"
    },
    {
      "adversary": "A3",
      "fidelity": "F2",
      "verdict": "not_tested",
      "reason": "out_of_scope_threat_model"
    },
    {
      "adversary": "A3",
      "fidelity": "F3",
      "verdict": "not_tested",
      "reason": "out_of_scope_threat_model"
    }
  ],
  "scrubber_fingerprint": {
    "checked": true,
    "verdict": "pass",
    "mandatory_constants_excluded": [],
    "signatures": []
  }
}