{
  "format": "m4a",
  "tool": {
    "name": "irreversible_scrubber",
    "version": "0.1.0-p2",
    "invocation": "python -m src.scrub {in} {out} --fidelity {fidelity}"
  },
  "generated_at": "2026-09-22T17:47:44.903738+00:00",
  "harness_version": "0.1.0",
  "cells": [
    {
      "adversary": "A1",
      "fidelity": "F1",
      "verdict": "pass",
      "noise_floor": {
        "deterministic": true,
        "repeats": 3,
        "variable_loci": []
      }
    },
    {
      "adversary": "A1",
      "fidelity": "F2",
      "verdict": "pass",
      "noise_floor": {
        "deterministic": true,
        "repeats": 3,
        "variable_loci": []
      }
    },
    {
      "adversary": "A1",
      "fidelity": "F3",
      "verdict": "pass",
      "noise_floor": {
        "deterministic": true,
        "repeats": 3,
        "variable_loci": []
      }
    },
    {
      "adversary": "A2",
      "fidelity": "F1",
      "verdict": "fail",
      "reason": "source fingerprint survives in muxer layout (box order / brand / free slack); the coded audio, reaching this channel through file size \u2014 a stream copy preserves the source's own encode by definition, so a higher-bitrate original stays a bigger file; reaching it requires F3. Features: struct:moov_before_mdat, struct:size, struct:top_level_order",
      "leaks": [
        {
          "kind": "source_fingerprint",
          "locus": {
            "space": "structural",
            "offset": null,
            "length": null,
            "feature_id": "struct:size",
            "annotated_as": null,
            "hex_context": null
          },
          "correlates_with": "producer (across 2)",
          "evidence": "struct:size constant within producer, differs across"
        },
        {
          "kind": "source_fingerprint",
          "locus": {
            "space": "structural",
            "offset": null,
            "length": null,
            "feature_id": "struct:moov_before_mdat",
            "annotated_as": null,
            "hex_context": null
          },
          "correlates_with": "producer (across 2)",
          "evidence": "struct:moov_before_mdat constant within producer, differs across"
        },
        {
          "kind": "source_fingerprint",
          "locus": {
            "space": "structural",
            "offset": null,
            "length": null,
            "feature_id": "struct:top_level_order",
            "annotated_as": null,
            "hex_context": null
          },
          "correlates_with": "producer (across 2)",
          "evidence": "struct:top_level_order constant within producer, differs across"
        }
      ]
    },
    {
      "adversary": "A2",
      "fidelity": "F2",
      "verdict": "fail",
      "reason": "source fingerprint survives in the coded audio, reaching this channel through file size \u2014 a stream copy preserves the source's own encode by definition, so a higher-bitrate original stays a bigger file; reaching it requires F3. Features: struct:size",
      "leaks": [
        {
          "kind": "source_fingerprint",
          "locus": {
            "space": "structural",
            "offset": null,
            "length": null,
            "feature_id": "struct:size",
            "annotated_as": null,
            "hex_context": null
          },
          "correlates_with": "producer (across 2)",
          "evidence": "struct:size constant within producer, differs across"
        }
      ]
    },
    {
      "adversary": "A2",
      "fidelity": "F3",
      "verdict": "fail",
      "reason": "source fingerprint survives in FILE SIZE, and nothing else. The muxer layout is fully normalized here, and producers whose first-generation audio was identical collapse to BYTE-IDENTICAL output. What still separates the remaining producer is that its source was encoded at a different bitrate, so its decoded audio re-compresses to a slightly different size (~1.4% on this corpus). That is the primary-encoding trace surfacing through a side channel: re-encoding cannot undo what the first encoder discarded, the audio analogue of Sorell's primary-quantization residual. Note the peer set holds CONTENT constant, which makes size a clean producer signal here; against real files of differing length and material it is far weaker. A size-bucketing pad would close it at the cost of bigger files \u2014 not currently done. Audio-space measurement (E-M4A-AUDIO): the source's own quality setting is recoverable from the sound at 0.88 on unscrubbed and copy-tier files and falls to chance after F3 (0.50 vs chance 0.50). Engine identity (ffmpeg AAC vs Apple AAC) is NOT separable even unscrubbed (0.56) \u2014 those two encoders are near-twins, so this corpus cannot answer the engine question either way. Scope: spectral features; MDCT-domain classifiers untested.. Features: struct:size",
      "leaks": [
        {
          "kind": "source_fingerprint",
          "locus": {
            "space": "structural",
            "offset": null,
            "length": null,
            "feature_id": "struct:size",
            "annotated_as": null,
            "hex_context": null
          },
          "correlates_with": "producer (across 2)",
          "evidence": "struct:size constant within producer, differs across"
        }
      ]
    },
    {
      "adversary": "A3",
      "fidelity": "F1",
      "verdict": "not_tested",
      "reason": "out_of_scope_threat_model"
    },
    {
      "adversary": "A3",
      "fidelity": "F2",
      "verdict": "not_tested",
      "reason": "out_of_scope_threat_model"
    },
    {
      "adversary": "A3",
      "fidelity": "F3",
      "verdict": "not_tested",
      "reason": "out_of_scope_threat_model"
    }
  ],
  "scrubber_fingerprint": {
    "checked": true,
    "verdict": "pass",
    "mandatory_constants_excluded": [
      {
        "bytes_hex": "66747970",
        "decoded": "ftyp"
      },
      {
        "bytes_hex": "6d6f6f76",
        "decoded": "moov"
      },
      {
        "bytes_hex": "6d646174",
        "decoded": "mdat"
      },
      {
        "bytes_hex": "6d766864",
        "decoded": "mvhd"
      },
      {
        "bytes_hex": "7472616b",
        "decoded": "trak"
      },
      {
        "bytes_hex": "6d646961",
        "decoded": "mdia"
      },
      {
        "bytes_hex": "6d696e66",
        "decoded": "minf"
      },
      {
        "bytes_hex": "7374626c",
        "decoded": "stbl"
      },
      {
        "bytes_hex": "73747364",
        "decoded": "stsd"
      },
      {
        "bytes_hex": "6d703461",
        "decoded": "mp4a"
      },
      {
        "bytes_hex": "00000000002168646c720000000000000000736f756e000000000000000000000000000000",
        "decoded": "\u0000\u0000\u0000\u0000\u0000!hdlr\u0000\u0000\u0000\u0000\u0000\u0000\u0000\u0000soun\u0000\u0000\u0000\u0000\u0000\u0000\u0000\u0000\u0000\u0000\u0000\u0000\u0000\u0000\u0000"
      },
      {
        "bytes_hex": "00000000002168646c72000000000000000076696465000000000000000000000000000000",
        "decoded": "\u0000\u0000\u0000\u0000\u0000!hdlr\u0000\u0000\u0000\u0000\u0000\u0000\u0000\u0000vide\u0000\u0000\u0000\u0000\u0000\u0000\u0000\u0000\u0000\u0000\u0000\u0000\u0000\u0000\u0000"
      },
      {
        "bytes_hex": "00000000002168646c7200000000000000006d646972000000000000000000000000000000",
        "decoded": "\u0000\u0000\u0000\u0000\u0000!hdlr\u0000\u0000\u0000\u0000\u0000\u0000\u0000\u0000mdir\u0000\u0000\u0000\u0000\u0000\u0000\u0000\u0000\u0000\u0000\u0000\u0000\u0000\u0000\u0000"
      },
      {
        "bytes_hex": "00000000002168646c7200000000000000006d647461000000000000000000000000000000",
        "decoded": "\u0000\u0000\u0000\u0000\u0000!hdlr\u0000\u0000\u0000\u0000\u0000\u0000\u0000\u0000mdta\u0000\u0000\u0000\u0000\u0000\u0000\u0000\u0000\u0000\u0000\u0000\u0000\u0000\u0000\u0000"
      }
    ],
    "signatures": []
  }
}